{
  "$schema": "https://schemas.vik.guru/visual-fidelity-contracts/1.0.0/catalog.schema.json",
  "schemaVersion": "1.0.0",
  "id": "vfc:catalog",
  "reviewedOn": "2026-10-20",
  "authority": {
    "semanticOwner": "Visual Fidelity Contracts maintainers",
    "schemaOwner": "Visual Fidelity Contracts schema maintainers",
    "publicationOwner": "Vikrant Varun Kudesia — named human publication receiver"
  },
  "contracts": [
    {
      "id": "vfc:industrial-ink",
      "title": "Industrial Ink",
      "kind": "art_direction_contract",
      "standing": "review_candidate",
      "version": "1.0.0",
      "profile": "art_direction_v1",
      "sourcePath": "visual-fidelity-contracts/contracts/industrial-ink/README.md",
      "recordPath": "visual-fidelity-contracts/contracts/industrial-ink/contract.v1.json",
      "tokensPath": "visual-fidelity-contracts/contracts/industrial-ink/tokens.css",
      "specimenPath": "visual-fidelity-contracts/contracts/industrial-ink/specimen.html",
      "publicRoute": "https://kindlight.systems/visual-fidelity-contracts/industrial-ink-visual-fidelity-contract",
      "examples": ["visual-fidelity-contracts/contracts/industrial-ink/specimen.html"],
      "tests": [
        "tests/visual-fidelity-contracts/foundation-contracts.test.mjs",
        "tests/visual-fidelity-contracts/contract-art-directions.test.mjs"
      ]
    },
    {
      "id": "vfc:soft-color-blocking",
      "title": "Soft Color Blocking",
      "kind": "art_direction_contract",
      "standing": "review_candidate",
      "version": "1.0.0",
      "profile": "art_direction_v1",
      "sourcePath": "visual-fidelity-contracts/contracts/soft-color-blocking/README.md",
      "recordPath": "visual-fidelity-contracts/contracts/soft-color-blocking/contract.v1.json",
      "tokensPath": "visual-fidelity-contracts/contracts/soft-color-blocking/tokens.css",
      "specimenPath": "visual-fidelity-contracts/contracts/soft-color-blocking/specimen.html",
      "publicRoute": "https://kindlight.systems/visual-fidelity-contracts/soft-color-blocking-visual-fidelity-contract",
      "examples": [
        "collaboration/context-tree-visual-variants/index.html",
        "collaboration/impact-map-visual-variants/index.html",
        "context-canvas-project-surface/context-canvas/who-to-believe-reviews-platform.html",
        "context-canvas-project-surface/context-canvas/visualization-fidelity-atlas.html",
        "visual-fidelity-contracts/contracts/soft-color-blocking/specimen.html"
      ],
      "tests": [
        "tests/visual-fidelity-contracts/foundation-contracts.test.mjs",
        "tests/visual-fidelity-contracts/contract-art-directions.test.mjs",
        "tests/visual-fidelity-contracts/contract-art-directions.browser.mjs",
        "tests/visualization-fidelity-atlas/atlas-cascade.browser.mjs"
      ]
    },
    {
      "id": "vfc:cobalt-operating-field",
      "title": "Cobalt Operating Field",
      "kind": "repository_composition_contract",
      "standing": "established",
      "version": "0.1.0",
      "profile": "legacy_document",
      "sourcePath": "visual-fidelity-contracts/cobalt-operating-field.md",
      "tokensPath": "visual-fidelity-contracts/cobalt-operating-field.tokens.css",
      "examples": [
        "collaboration/registry-goal-fidelity-routing/index.html",
        "context-canvas-project-surface/img/plot/genomic_viewer_case_review_workbench.svg"
      ],
      "tests": ["tests/context-canvas/visual-reference-observations.test.mjs"]
    },
    {
      "id": "vfc:cobalt-temporal-field",
      "title": "Cobalt Temporal Field",
      "kind": "repository_composition_contract",
      "standing": "established",
      "version": "0.1.0",
      "profile": "legacy_document",
      "sourcePath": "visual-fidelity-contracts/cobalt-temporal-field.md",
      "examples": ["context-canvas-project-surface/context-canvas/fmi-lims-eln-replatforming.html"],
      "tests": ["tests/context-canvas/visual-reference-observations.test.mjs"]
    },
    {
      "id": "vfc:rose-quartz-editorial-field",
      "title": "Rose Quartz Editorial Field",
      "kind": "repository_composition_contract",
      "standing": "established",
      "version": "0.1.0",
      "profile": "legacy_document",
      "sourcePath": "visual-fidelity-contracts/rose-quartz-editorial-field.md",
      "examples": [
        "collaboration/context-tree-visual-variants/genomic-viewer-presentation.html",
        "context-canvas-project-surface/context-canvas/genomic-viewer-replatforming.html"
      ],
      "tests": ["tests/context-canvas/visual-reference-observations.test.mjs"]
    },
    {
      "id": "vfc:cobalt-constellation-field",
      "title": "Cobalt Constellation Field",
      "kind": "repository_composition_contract",
      "standing": "established",
      "version": "0.1.0",
      "profile": "legacy_document",
      "sourcePath": "visual-fidelity-contracts/cobalt-constellation-field.md",
      "examples": ["collaboration/lims-eln-program-constellation/index.html"],
      "tests": ["tests/context-canvas/visual-reference-observations.test.mjs"]
    },
    {
      "id": "vfc:dual-track-debrief-composition",
      "title": "Dual-Track Debrief Composition",
      "kind": "repository_composition_contract",
      "standing": "established",
      "version": "0.1.0",
      "profile": "legacy_document",
      "sourcePath": "visual-fidelity-contracts/dual-track-debrief-composition.md",
      "examples": [
        "context-canvas-project-surface/context-canvas/genomic-viewer-replatforming.html",
        "context-canvas-project-surface/context-canvas/fmi-clinical-trial-coordination.html"
      ],
      "tests": ["tests/context-canvas/debrief-reading-layout.browser.mjs"]
    },
    {
      "id": "vfc:tiffany-ledger-field",
      "title": "Tiffany Ledger Field",
      "kind": "repository_composition_contract",
      "standing": "established",
      "version": "0.1.0",
      "profile": "legacy_document",
      "sourcePath": "visual-fidelity-contracts/tiffany-ledger-field.md",
      "examples": [
        "context-canvas-project-surface/context-canvas/index.html",
        "collaboration/career-quality-visual-variants/index.html"
      ],
      "tests": ["tests/context-canvas/about-first-paint-css.test.mjs"]
    },
    {
      "id": "vfc:tiffany-conditions-routing-field",
      "title": "Tiffany Conditions & Routing Field",
      "kind": "repository_composition_contract",
      "standing": "established",
      "version": "0.1.0",
      "profile": "legacy_document",
      "sourcePath": "visual-fidelity-contracts/tiffany-conditions-routing-field.md",
      "examples": ["collaboration/about-prompt-conditions-explorer/index.html"],
      "tests": ["tests/context-canvas/about-first-paint-css.test.mjs"]
    }
  ],
  "resources": [
    {
      "id": "vfc-resource:component-lab",
      "title": "Component ownership and recovery lab",
      "kind": "executable_lab",
      "standing": "review_candidate",
      "version": "1.0.0",
      "sourcePath": "visual-fidelity-contracts/labs/component-lab/README.md",
      "publicRoute": "https://kindlight.systems/visual-fidelity-contracts/visual-fidelity-component-lab-panels-drawers-commerce-flows",
      "tests": [
        "tests/visual-fidelity-contracts/component-model.test.mjs",
        "tests/visual-fidelity-contracts/component-page.test.mjs",
        "tests/visual-fidelity-contracts/component.browser.mjs"
      ]
    },
    {
      "id": "vfc-resource:data-view-lab",
      "title": "Data shape, state, and evidence lab",
      "kind": "executable_lab",
      "standing": "review_candidate",
      "version": "1.0.0",
      "sourcePath": "visual-fidelity-contracts/labs/data-view-lab/README.md",
      "publicRoute": "https://kindlight.systems/visual-fidelity-contracts/visual-fidelity-data-view-lab-shape-state-evidence",
      "tests": [
        "tests/visual-fidelity-contracts/data-view-model.test.mjs",
        "tests/visual-fidelity-contracts/data-view-page.test.mjs",
        "tests/visual-fidelity-contracts/data-view-browser.test.mjs"
      ]
    },
    {
      "id": "vfc-resource:lifecycle-lab",
      "title": "Browser and framework lifecycle lab",
      "kind": "executable_lab",
      "standing": "review_candidate",
      "version": "1.0.0",
      "sourcePath": "visual-fidelity-contracts/labs/lifecycle-lab/README.md",
      "publicRoute": "https://kindlight.systems/visual-fidelity-contracts/visual-fidelity-practitioner-probes-layered-judgment-evidence/visual-fidelity-probes-framework-lifecycles-stateful-composition",
      "tests": [
        "tests/visual-fidelity-contracts/lifecycle-model.test.mjs",
        "tests/visual-fidelity-contracts/lifecycle-source.test.mjs",
        "tests/visual-fidelity-contracts/lifecycle-browser.test.mjs",
        "tests/visual-fidelity-contracts/lifecycle-framework-adapters.browser.mjs"
      ]
    },
    {
      "id": "vfc-resource:service-boundary-lab",
      "title": "Service boundary and bounded caller lab",
      "kind": "executable_lab",
      "standing": "review_candidate",
      "version": "1.2.0",
      "sourcePath": "visual-fidelity-contracts/labs/service-boundary-lab/README.md",
      "publicRoute": "https://kindlight.systems/visual-fidelity-contracts/visual-fidelity-practitioner-probes-layered-judgment-evidence/visual-fidelity-probes-back-end-runtime-transactions-framework-boundaries",
      "tests": [
        "tests/visual-fidelity-contracts/service-boundary-model.test.mjs",
        "tests/visual-fidelity-contracts/service-boundary.browser.mjs"
      ]
    },
    {
      "id": "vfc-resource:components-and-data-probes",
      "title": "Component ownership, errors, and recovery probes",
      "kind": "practitioner_probe",
      "standing": "review_candidate",
      "version": "1.0.0",
      "sourcePath": "visual-fidelity-contracts/probes/components-and-data/README.md",